[
  {
    "name": "Dublin 1",
    "description": "North City",
    "status": "RESEARCH_IN_PROGRESS",
    "geographic_type": "POSTAL_DISTRICT",
    "coverage_notes": "Research is in progress with 54 catalogue records. This is an expanding sample, not a comprehensive survey; founder photography and on-site coordinate verification remain outstanding. Operational fieldwork zone only; not an administrative boundary."
  },
  {
    "name": "Dublin 2",
    "description": "Historic Centre",
    "status": "RESEARCH_IN_PROGRESS",
    "geographic_type": "POSTAL_DISTRICT",
    "coverage_notes": "Research is in progress with 35 catalogue records. This is an expanding sample, not a comprehensive survey; founder photography and on-site coordinate verification remain outstanding. Operational fieldwork zone only; not an administrative boundary."
  },
  {
    "name": "Dublin 3",
    "description": "North-East Dublin",
    "status": "RESEARCH_IN_PROGRESS",
    "geographic_type": "POSTAL_DISTRICT",
    "coverage_notes": "Research is in progress with 64 catalogue records. This is an expanding sample, not a comprehensive survey; founder photography and on-site coordinate verification remain outstanding. Operational fieldwork zone only; not an administrative boundary."
  },
  {
    "name": "Dublin 4",
    "description": "South-East Dublin",
    "status": "NOT_YET_RESEARCHED",
    "geographic_type": "POSTAL_DISTRICT",
    "coverage_notes": "Operational fieldwork zone only; not an administrative boundary. Research coverage is not yet complete."
  },
  {
    "name": "Dublin 5",
    "description": "North-East suburbs",
    "status": "NOT_YET_RESEARCHED",
    "geographic_type": "POSTAL_DISTRICT",
    "coverage_notes": "Operational fieldwork zone only; not an administrative boundary. Research coverage is not yet complete."
  },
  {
    "name": "Dublin 6",
    "description": "Rathmines and surrounding areas",
    "status": "NOT_YET_RESEARCHED",
    "geographic_type": "POSTAL_DISTRICT",
    "coverage_notes": "Operational fieldwork zone only; not an administrative boundary. Research coverage is not yet complete."
  },
  {
    "name": "Dublin 6W",
    "description": "South-West suburbs",
    "status": "NOT_YET_RESEARCHED",
    "geographic_type": "POSTAL_DISTRICT",
    "coverage_notes": "Operational fieldwork zone only; not an administrative boundary. Research coverage is not yet complete."
  },
  {
    "name": "Dublin 7",
    "description": "Smithfield and surrounding areas",
    "status": "NOT_YET_RESEARCHED",
    "geographic_type": "POSTAL_DISTRICT",
    "coverage_notes": "Operational fieldwork zone only; not an administrative boundary. Research coverage is not yet complete."
  },
  {
    "name": "Dublin 8",
    "description": "The Liberties and Kilmainham",
    "status": "NOT_YET_RESEARCHED",
    "geographic_type": "POSTAL_DISTRICT",
    "coverage_notes": "Operational fieldwork zone only; not an administrative boundary. Research coverage is not yet complete."
  },
  {
    "name": "Dublin 9",
    "description": "Drumcondra and surrounding areas",
    "status": "NOT_YET_RESEARCHED",
    "geographic_type": "POSTAL_DISTRICT",
    "coverage_notes": "Operational fieldwork zone only; not an administrative boundary. Research coverage is not yet complete."
  },
  {
    "name": "Dublin 10",
    "description": "Ballyfermot",
    "status": "NOT_YET_RESEARCHED",
    "geographic_type": "POSTAL_DISTRICT",
    "coverage_notes": "Operational fieldwork zone only; not an administrative boundary. Research coverage is not yet complete."
  },
  {
    "name": "Dublin 11",
    "description": "Finglas",
    "status": "NOT_YET_RESEARCHED",
    "geographic_type": "POSTAL_DISTRICT",
    "coverage_notes": "Operational fieldwork zone only; not an administrative boundary. Research coverage is not yet complete."
  },
  {
    "name": "Dublin 12",
    "description": "Crumlin and surrounding areas",
    "status": "NOT_YET_RESEARCHED",
    "geographic_type": "POSTAL_DISTRICT",
    "coverage_notes": "Operational fieldwork zone only; not an administrative boundary. Research coverage is not yet complete."
  },
  {
    "name": "Dublin 13",
    "description": "Coastal North Dublin",
    "status": "NOT_YET_RESEARCHED",
    "geographic_type": "POSTAL_DISTRICT",
    "coverage_notes": "Operational fieldwork zone only; not an administrative boundary. Research coverage is not yet complete."
  },
  {
    "name": "Dublin 14",
    "description": "South Dublin",
    "status": "NOT_YET_RESEARCHED",
    "geographic_type": "POSTAL_DISTRICT",
    "coverage_notes": "Operational fieldwork zone only; not an administrative boundary. Research coverage is not yet complete."
  },
  {
    "name": "Dublin 15",
    "description": "Blanchardstown",
    "status": "NOT_YET_RESEARCHED",
    "geographic_type": "POSTAL_DISTRICT",
    "coverage_notes": "Operational fieldwork zone only; not an administrative boundary. Research coverage is not yet complete."
  },
  {
    "name": "Dublin 16",
    "description": "South-West Dublin",
    "status": "NOT_YET_RESEARCHED",
    "geographic_type": "POSTAL_DISTRICT",
    "coverage_notes": "Operational fieldwork zone only; not an administrative boundary. Research coverage is not yet complete."
  },
  {
    "name": "Dublin 17",
    "description": "North-East Dublin",
    "status": "NOT_YET_RESEARCHED",
    "geographic_type": "POSTAL_DISTRICT",
    "coverage_notes": "Operational fieldwork zone only; not an administrative boundary. Research coverage is not yet complete."
  },
  {
    "name": "Dublin 18",
    "description": "South-East Dublin",
    "status": "NOT_YET_RESEARCHED",
    "geographic_type": "POSTAL_DISTRICT",
    "coverage_notes": "Operational fieldwork zone only; not an administrative boundary. Research coverage is not yet complete."
  },
  {
    "name": "Dublin 20",
    "description": "Chapelizod",
    "status": "NOT_YET_RESEARCHED",
    "geographic_type": "POSTAL_DISTRICT",
    "coverage_notes": "Operational fieldwork zone only; not an administrative boundary. Research coverage is not yet complete."
  },
  {
    "name": "Dublin 22",
    "description": "Clondalkin",
    "status": "NOT_YET_RESEARCHED",
    "geographic_type": "POSTAL_DISTRICT",
    "coverage_notes": "Operational fieldwork zone only; not an administrative boundary. Research coverage is not yet complete."
  },
  {
    "name": "Dublin 24",
    "description": "Tallaght",
    "status": "NOT_YET_RESEARCHED",
    "geographic_type": "POSTAL_DISTRICT",
    "coverage_notes": "Operational fieldwork zone only; not an administrative boundary. Research coverage is not yet complete."
  }
]
